{
  "id": "visual-basis-r2-bases",
  "concept": "basis",
  "type": "comparison",
  "learning_goal": { "ja": "R²には異なる見た目の基底が複数あり得ることを理解する。", "en": "Understand that R2 can have multiple bases with different directions." },
  "target_claim": "basis-claim-01",
  "learner_question": { "ja": "標準基底でない斜めの二本も、なぜ平面の基底になれるのか。", "en": "Why can two slanted vectors form a basis even when they are not standard axes?" },
  "layout": { "type": "two_panel_comparison", "panels": [{ "title": "standard basis", "meaning": "horizontal_and_vertical_directions" }, { "title": "non-standard basis", "meaning": "independent_slanted_directions" }] },
  "labels": ["R²", "e₁", "e₂", "b₁", "b₂", "span", "independent"],
  "visual_encoding": "Two panels use the same plane and a shared target point; arrows show two different pairs of independent directions, while the caption states that both pairs span R².",
  "misconception_risk": ["The slanted pair must be orthogonal.", "Only the standard basis can be a basis."],
  "source_claims": ["basis-claim-01", "basis-claim-03"],
  "placement": { "lesson": "basis-lesson-03", "position": "after-standard-and-nonstandard" },
  "alt_text": { "ja": "同じR²の平面に、標準基底の水平・垂直の二本と、斜めに開いた非標準基底の二本を左右で比較し、どちらも平面をspanし独立であると示す図。", "en": "Two panels compare horizontal-vertical standard basis vectors with slanted independent non-standard basis vectors; both span R2." },
  "status": "published",
  "output_path": "visuals/basis-r2-bases.svg",
  "svg": "<svg xmlns=\"http://www.w3.org/2000/svg\" viewBox=\"0 0 900 300\" role=\"img\" aria-label=\"Two different bases for R2\"><rect width=\"900\" height=\"300\" rx=\"20\" fill=\"#f7faf3\"/><text x=\"450\" y=\"34\" text-anchor=\"middle\" font-family=\"sans-serif\" font-size=\"22\" font-weight=\"700\" fill=\"#18321f\">R²には複数の基底がある</text><g stroke=\"#c9d8cc\" stroke-width=\"1\"><path d=\"M75 245H375M225 275V70M525 245H825M675 275V70\"/></g><g stroke=\"#71a287\" stroke-width=\"5\"><path d=\"M225 245L345 245\"/><path d=\"M225 245L225 105\"/><path d=\"M675 245L795 185\"/><path d=\"M675 245L735 105\"/></g><g font-family=\"sans-serif\" text-anchor=\"middle\" fill=\"#18321f\"><text x=\"225\" y=\"290\" font-size=\"16\">標準基底</text><text x=\"675\" y=\"290\" font-size=\"16\">非標準基底</text><text x=\"225\" y=\"58\" font-size=\"14\">span ✓ / independent ✓</text><text x=\"675\" y=\"58\" font-size=\"14\">span ✓ / independent ✓</text><text x=\"345\" y=\"238\" font-size=\"14\">e₁</text><text x=\"235\" y=\"105\" font-size=\"14\">e₂</text><text x=\"795\" y=\"179\" font-size=\"14\">b₁</text><text x=\"742\" y=\"103\" font-size=\"14\">b₂</text></g></svg>"
}
