{
  "id": "visual-vector-arrow-components",
  "concept": "vector",
  "type": "geometric-diagram",
  "learning_goal": { "ja": "同じ変位を、始点の異なる矢印と成分組で対応づける。", "en": "Connect translated arrows representing the same displacement with their component form." },
  "target_claim": "vector-claim-01",
  "learner_question": { "ja": "始点が違う二本の矢印を同じベクトルとみなせるのはなぜか。", "en": "Why can two arrows with different starting points represent the same vector?" },
  "layout": { "type": "two_panel_comparison", "panels": [{ "title": "矢印", "meaning": "same_displacement_translated" }, { "title": "成分", "meaning": "horizontal_and_vertical_change" }] },
  "labels": ["u", "(3,2)", "始点", "終点", "Δx=3", "Δy=2"],
  "visual_encoding": "Two arrows have different starting points but equal horizontal and vertical displacement; a component label makes the invariant displacement explicit.",
  "misconception_risk": ["矢印は始点に固定される", "点の座標とベクトルの成分を同一視する"],
  "source_claims": ["vector-claim-01"],
  "placement": { "lesson": "vector-lesson-01", "position": "after-concrete-problem" },
  "alt_text": { "ja": "異なる始点から同じ右へ3、上へ2の移動をする二本の矢印を並べ、どちらも成分表示u=(3,2)に対応すると示す図。", "en": "Two arrows from different starting points both move 3 right and 2 up, corresponding to the same component vector u=(3,2)." },
  "status": "published",
  "output_path": "diagrams/vector-arrow-components.svg",
  "svg": "<svg xmlns=\"http://www.w3.org/2000/svg\" viewBox=\"0 0 900 320\" role=\"img\" aria-label=\"Same displacement, different starting points\"><rect width=\"900\" height=\"320\" rx=\"20\" fill=\"#f7faf3\"/><text x=\"450\" y=\"38\" text-anchor=\"middle\" font-family=\"sans-serif\" font-size=\"24\" font-weight=\"700\" fill=\"#18321f\">同じ変位 u = (3, 2)</text><g stroke=\"#c9d8cc\" stroke-width=\"1\"><path d=\"M70 255H420M70 205H420M70 155H420M70 105H420M120 285V70M220 285V70M320 285V70M420 285V70\"/><path d=\"M500 255H840M500 205H840M500 155H840M500 105H840M550 285V70M650 285V70M750 285V70M850 285V70\"/></g><g stroke=\"#df8a52\" stroke-width=\"6\" fill=\"none\"><path d=\"M120 255L320 155\"/><path d=\"M550 205L750 105\"/></g><g fill=\"#df8a52\"><path d=\"M320 155l-18 2 9 16z\"/><path d=\"M750 105l-18 2 9 16z\"/></g><g font-family=\"sans-serif\" font-size=\"16\" fill=\"#18321f\"><text x=\"145\" y=\"245\">始点A</text><text x=\"325\" y=\"145\">終点A</text><text x=\"575\" y=\"195\">始点B</text><text x=\"755\" y=\"95\">終点B</text><text x=\"382\" y=\"288\">矢印を平行移動しても変位は同じ</text><text x=\"625\" y=\"285\">Δx=3, Δy=2</text></g></svg>"
}
